Speed Full
Bus 001 Device 003: ID 058f:6366 Alcor Micro Corp. Multi Flash Reader
Device Descriptor:
  bLength                18
  bDescriptorType         1
  bcdUSB               2.00
  bDeviceClass            0 (Defined at Interface level)
  bDeviceSubClass         0 
  bDeviceProtocol         0 
  bMaxPacketSize0        64
  idVendor           0x0763 Midiman
  idProduct          0x1002 MidiSport 2x2
  bcdDevice            1.00
  iManufacturer           1 Generic
  iProduct                2 Mass Storage Device
  iSerial                 3 058F63666471
  bNumConfigurations      1
  Configuration Descriptor:
    bLength                 9
    bDescriptorType         2
    wTotalLength           32
    bNumInterfaces          1
    bConfigurationValue     1
    iConfiguration          0 
    bmAttributes         0x80
      (Bus Powered)
    MaxPower              100mA
    Interface Descriptor:
      bLength                 9
      bDescriptorType         4
      bInterfaceNumber        0
      bAlternateSetting       0
      bNumEndpoints           0
      bInterfaceClass       255 Vendor Specific Class
      bInterfaceSubClass      0
      bInterfaceProtocol      0
      iInterface              0 

